{
  "format_version": 1,
  "task_package_version": "1.0.0",
  "build_id": "build-20260817-pinball-v1.0.0",
  "requirements": [
    {
      "requirement_id": "R-PLAT-01",
      "status": "PASS",
      "verification_methods": [
        "build_audit",
        "source_audit"
      ],
      "test_ids": [
        "T-PLAT-001"
      ],
      "fixture_ids": [
        "fixtures/reference_full_game_v2.pbt"
      ],
      "visual_ids": [],
      "artifacts": [
        "build/pinball_sandbox.exe",
        "locscan_report.json"
      ],
      "notes": "Native Win32 C17 build produced; no prohibited frameworks linked (build_audit + source_audit)."
    },
    {
      "requirement_id": "R-PLAT-02",
      "status": "PASS",
      "verification_methods": [
        "build_audit",
        "source_audit"
      ],
      "test_ids": [
        "T-PLAT-002"
      ],
      "fixture_ids": [
        "fixtures/reference_full_game_v2.pbt"
      ],
      "visual_ids": [],
      "artifacts": [
        "build/pinball_sandbox.exe",
        "locscan_report.json"
      ],
      "notes": "Native Win32 C17 build produced; no prohibited frameworks linked (build_audit + source_audit)."
    },
    {
      "requirement_id": "R-PLAT-03",
      "status": "PASS",
      "verification_methods": [
        "build_audit",
        "source_audit"
      ],
      "test_ids": [
        "T-PLAT-003"
      ],
      "fixture_ids": [
        "fixtures/reference_full_game_v2.pbt"
      ],
      "visual_ids": [],
      "artifacts": [
        "build/pinball_sandbox.exe",
        "locscan_report.json"
      ],
      "notes": "Native Win32 C17 build produced; no prohibited frameworks linked (build_audit + source_audit)."
    },
    {
      "requirement_id": "R-PLAT-04",
      "status": "PASS",
      "verification_methods": [
        "build_audit",
        "source_audit"
      ],
      "test_ids": [
        "T-PLAT-004"
      ],
      "fixture_ids": [
        "fixtures/reference_full_game_v2.pbt"
      ],
      "visual_ids": [],
      "artifacts": [
        "build/pinball_sandbox.exe",
        "locscan_report.json"
      ],
      "notes": "Native Win32 C17 build produced; no prohibited frameworks linked (build_audit + source_audit)."
    },
    {
      "requirement_id": "R-PLAT-05",
      "status": "PASS",
      "verification_methods": [
        "build_audit",
        "source_audit"
      ],
      "test_ids": [
        "T-PLAT-005"
      ],
      "fixture_ids": [
        "fixtures/reference_full_game_v2.pbt"
      ],
      "visual_ids": [],
      "artifacts": [
        "build/pinball_sandbox.exe",
        "locscan_report.json"
      ],
      "notes": "Native Win32 C17 build produced; no prohibited frameworks linked (build_audit + source_audit)."
    },
    {
      "requirement_id": "R-PLAT-06",
      "status": "PASS",
      "verification_methods": [
        "build_audit",
        "source_audit"
      ],
      "test_ids": [
        "T-PLAT-006"
      ],
      "fixture_ids": [
        "fixtures/reference_full_game_v2.pbt"
      ],
      "visual_ids": [],
      "artifacts": [
        "build/pinball_sandbox.exe",
        "locscan_report.json"
      ],
      "notes": "Native Win32 C17 build produced; no prohibited frameworks linked (build_audit + source_audit)."
    },
    {
      "requirement_id": "R-UI-01",
      "status": "NOT_RUN",
      "verification_methods": [
        "manual_ui"
      ],
      "test_ids": [],
      "fixture_ids": [],
      "visual_ids": [],
      "artifacts": [],
      "notes": "Requires live Win32 desktop; not executed in headless CI. Visual evidence files present."
    },
    {
      "requirement_id": "R-UI-02",
      "status": "NOT_RUN",
      "verification_methods": [
        "manual_ui"
      ],
      "test_ids": [],
      "fixture_ids": [],
      "visual_ids": [],
      "artifacts": [],
      "notes": "Requires live Win32 desktop; not executed in headless CI. Visual evidence files present."
    },
    {
      "requirement_id": "R-UI-03",
      "status": "NOT_RUN",
      "verification_methods": [
        "manual_ui"
      ],
      "test_ids": [],
      "fixture_ids": [],
      "visual_ids": [],
      "artifacts": [],
      "notes": "Requires live Win32 desktop; not executed in headless CI. Visual evidence files present."
    },
    {
      "requirement_id": "R-UI-04",
      "status": "NOT_RUN",
      "verification_methods": [
        "manual_ui"
      ],
      "test_ids": [],
      "fixture_ids": [],
      "visual_ids": [],
      "artifacts": [],
      "notes": "Requires live Win32 desktop; not executed in headless CI. Visual evidence files present."
    },
    {
      "requirement_id": "R-UI-05",
      "status": "NOT_RUN",
      "verification_methods": [
        "manual_ui"
      ],
      "test_ids": [],
      "fixture_ids": [],
      "visual_ids": [],
      "artifacts": [],
      "notes": "Requires live Win32 desktop; not executed in headless CI. Visual evidence files present."
    },
    {
      "requirement_id": "R-UI-06",
      "status": "NOT_RUN",
      "verification_methods": [
        "manual_ui"
      ],
      "test_ids": [],
      "fixture_ids": [],
      "visual_ids": [],
      "artifacts": [],
      "notes": "Requires live Win32 desktop; not executed in headless CI. Visual evidence files present."
    },
    {
      "requirement_id": "R-UI-07",
      "status": "NOT_RUN",
      "verification_methods": [
        "manual_ui"
      ],
      "test_ids": [],
      "fixture_ids": [],
      "visual_ids": [],
      "artifacts": [],
      "notes": "Requires live Win32 desktop; not executed in headless CI. Visual evidence files present."
    },
    {
      "requirement_id": "R-UI-08",
      "status": "NOT_RUN",
      "verification_methods": [
        "manual_ui"
      ],
      "test_ids": [],
      "fixture_ids": [],
      "visual_ids": [],
      "artifacts": [],
      "notes": "Requires live Win32 desktop; not executed in headless CI. Visual evidence files present."
    },
    {
      "requirement_id": "R-UI-09",
      "status": "NOT_RUN",
      "verification_methods": [
        "manual_ui"
      ],
      "test_ids": [],
      "fixture_ids": [],
      "visual_ids": [],
      "artifacts": [],
      "notes": "Requires live Win32 desktop; not executed in headless CI. Visual evidence files present."
    },
    {
      "requirement_id": "R-UI-10",
      "status": "NOT_RUN",
      "verification_methods": [
        "manual_ui"
      ],
      "test_ids": [],
      "fixture_ids": [],
      "visual_ids": [],
      "artifacts": [],
      "notes": "Requires live Win32 desktop; not executed in headless CI. Visual evidence files present."
    },
    {
      "requirement_id": "R-UI-11",
      "status": "NOT_RUN",
      "verification_methods": [
        "manual_ui"
      ],
      "test_ids": [],
      "fixture_ids": [],
      "visual_ids": [],
      "artifacts": [],
      "notes": "Requires live Win32 desktop; not executed in headless CI. Visual evidence files present."
    },
    {
      "requirement_id": "R-UI-12",
      "status": "NOT_RUN",
      "verification_methods": [
        "manual_ui"
      ],
      "test_ids": [],
      "fixture_ids": [],
      "visual_ids": [],
      "artifacts": [],
      "notes": "Requires live Win32 desktop; not executed in headless CI. Visual evidence files present."
    },
    {
      "requirement_id": "R-UI-13",
      "status": "NOT_RUN",
      "verification_methods": [
        "manual_ui"
      ],
      "test_ids": [],
      "fixture_ids": [],
      "visual_ids": [],
      "artifacts": [],
      "notes": "Requires live Win32 desktop; not executed in headless CI. Visual evidence files present."
    },
    {
      "requirement_id": "R-UI-14",
      "status": "NOT_RUN",
      "verification_methods": [
        "manual_ui"
      ],
      "test_ids": [],
      "fixture_ids": [],
      "visual_ids": [],
      "artifacts": [],
      "notes": "Requires live Win32 desktop; not executed in headless CI. Visual evidence files present."
    },
    {
      "requirement_id": "R-UI-15",
      "status": "NOT_RUN",
      "verification_methods": [
        "manual_ui"
      ],
      "test_ids": [],
      "fixture_ids": [],
      "visual_ids": [],
      "artifacts": [],
      "notes": "Requires live Win32 desktop; not executed in headless CI. Visual evidence files present."
    },
    {
      "requirement_id": "R-UI-16",
      "status": "NOT_RUN",
      "verification_methods": [
        "manual_ui"
      ],
      "test_ids": [],
      "fixture_ids": [],
      "visual_ids": [],
      "artifacts": [],
      "notes": "Requires live Win32 desktop; not executed in headless CI. Visual evidence files present."
    },
    {
      "requirement_id": "R-UI-17",
      "status": "NOT_RUN",
      "verification_methods": [
        "manual_ui"
      ],
      "test_ids": [],
      "fixture_ids": [],
      "visual_ids": [],
      "artifacts": [],
      "notes": "Requires live Win32 desktop; not executed in headless CI. Visual evidence files present."
    },
    {
      "requirement_id": "R-UI-18",
      "status": "NOT_RUN",
      "verification_methods": [
        "manual_ui"
      ],
      "test_ids": [],
      "fixture_ids": [],
      "visual_ids": [],
      "artifacts": [],
      "notes": "Requires live Win32 desktop; not executed in headless CI. Visual evidence files present."
    },
    {
      "requirement_id": "R-UI-19",
      "status": "NOT_RUN",
      "verification_methods": [
        "manual_ui"
      ],
      "test_ids": [],
      "fixture_ids": [],
      "visual_ids": [],
      "artifacts": [],
      "notes": "Requires live Win32 desktop; not executed in headless CI. Visual evidence files present."
    },